{
  "engagement_id": "engagement-6fee7322-0022-4d82-aa8a-838436b7307e",
  "brief_id": "brief-8b510e3c-3829-409f-83b4-363d1e358fda",
  "vault_path": "/engagements/engagement-6fee7322-0022-4d82-aa8a-838436b7307e/vault",
  "scope": "per-engagement",
  "created_at": "2026-08-15T16:17:47.969Z",
  "expires_at": "2026-08-29T16:17:47.969Z",
  "client_approval_required_before_use": true,
  "items": [
    {
      "item_id": "item-45dd73f4-85a9-4bf2-9af5-adaf0231bde5",
      "name": "Lead workflow export",
      "type": "file",
      "path": "lead-workflow.json",
      "provenance": "Client export from n8n",
      "collected_at": "2026-08-15T16:17:47.969Z",
      "collection_method": "user_upload",
      "classification": "internal",
      "access_restrictions": [
        "freelancer_only"
      ],
      "notes": "Contains workflow logic and API endpoints. Do not share externally."
    },
    {
      "item_id": "item-1d4745ff-5bf5-48b3-8130-1642fc8802fe",
      "name": "Error log (last 7 days)",
      "type": "file",
      "path": "error-log.csv",
      "provenance": "Client export from n8n logs",
      "collected_at": "2026-08-15T16:17:47.969Z",
      "collection_method": "user_upload",
      "classification": "confidential",
      "access_restrictions": [
        "freelancer_only"
      ],
      "notes": "Contains timestamps and error details. May contain PII."
    }
  ],
  "access_control": {
    "freelancer_access": "none",
    "client_access": "revoke_anytime",
    "audit_access": "log_only"
  },
  "audit_log": [
    {
      "timestamp": "2026-08-15T16:17:47.969Z",
      "actor": "system",
      "action": "vault_created",
      "details": "Vault created for engagement engagement-6fee7322-0022-4d82-aa8a-838436b7307e",
      "item_ids": []
    },
    {
      "timestamp": "2026-08-15T16:17:47.969Z",
      "actor": "agent_intake",
      "action": "items_collected",
      "details": "2 item(s) from the client response added to the vault",
      "item_ids": [
        "item-45dd73f4-85a9-4bf2-9af5-adaf0231bde5",
        "item-1d4745ff-5bf5-48b3-8130-1642fc8802fe"
      ]
    }
  ],
  "revocation_conditions": {
    "automatic_expiry_utc": "2026-08-29T16:17:47.969Z",
    "manual_revocation_by_client": true,
    "on_expiry_action": "lock_read_only",
    "retention_after_expiry": "90d"
  },
  "approvals": []
}